{
  "generated": {
    "at": "2026-08-27T23:06:51Z",
    "by": "policy_author",
    "prompt_sha": "8d27d7284175",
    "register_sha": "cb977359b463b028",
    "reviewed": true,
    "reviewed_at": "2026-08-27T23:07:14Z",
    "reviewed_by": "Noah Donaldson"
  },
  "policies": [
    {
      "derived_from": {
        "paragraphs": [
          33
        ],
        "principle": 2
      },
      "description": "<p><strong>Principle 2 &mdash; Data architecture and IT infrastructure.</strong> The bank shall establish and maintain integrated data taxonomies and architecture across the banking group, including metadata, single identifiers, and unified naming conventions for all legal entities, counterparties, customers, and accounts, so that risk data can be consistently linked and aggregated group-wide.</p><p><em>&para;33:</em> &ldquo;A bank should establish integrated data taxonomies and architecture across the banking group, which includes information on the characteristics of the data (metadata), as well as use of single identifiers and/or unified naming conventions for data including legal entities, counterparties, customers and accounts.&rdquo;</p>",
      "ref": "POL-DATAARCH",
      "title": "Data Architecture and Integrated Taxonomy"
    },
    {
      "derived_from": {
        "paragraphs": [
          36,
          39
        ],
        "principle": 3
      },
      "description": "<p><strong>Principle 3 &mdash; Accuracy and Integrity.</strong> The bank shall aggregate risk data in a manner that is accurate and reliable, with controls as robust as those applicable to accounting data; shall reconcile risk data to authoritative sources including the general ledger; and shall document all manual and automated aggregation processes with effective mitigants in place for any end-user computing reliance.</p><p><em>&para;36:</em> &ldquo;A bank should aggregate risk data in a way that is accurate and reliable. Controls surrounding risk data should be as robust as those applicable to accounting data.&rdquo;</p><p><em>&para;36:</em> &ldquo;Risk data should be reconciled with bank's sources, including accounting data where appropriate, to ensure that the risk data is accurate.&rdquo;</p><p><em>&para;39:</em> &ldquo;Where a bank relies on manual processes and desktop applications (eg spreadsheets, databases) &hellip; it should have effective mitigants in place. &hellip; Supervisors expect banks to document and explain all of their risk data aggregation processes whether automated or manual.&rdquo;</p>",
      "ref": "POL-ACCURACY",
      "title": "Risk Data Accuracy and Integrity"
    },
    {
      "derived_from": {
        "paragraphs": [
          41,
          43
        ],
        "principle": 4
      },
      "description": "<p><strong>Principle 4 &mdash; Completeness.</strong> The bank shall capture all material risk exposures &mdash; including off-balance-sheet positions &mdash; across every business line, legal entity, asset type, industry, and region, and shall measure and monitor completeness gaps, assessing their impact on the bank's ability to manage risk effectively.</p><p><em>&para;41:</em> &ldquo;A bank's risk data aggregation capabilities should include all material risk exposures, including those that are off-balance sheet.&rdquo;</p><p><em>&para;41:</em> &ldquo;Data should be available by business line, legal entity, asset type, industry, region and other groupings, as relevant for the risk in question, that permit identifying and reporting risk exposures, concentrations and emerging risks.&rdquo;</p><p><em>&para;43:</em> &ldquo;Supervisors expect banks to produce aggregated risk data that is complete and to measure and monitor the completeness of their risk data. Where risk data is not entirely complete, the impact should not be critical to the bank's ability to manage its risks effectively.&rdquo;</p>",
      "ref": "POL-COMPLETE",
      "title": "Risk Data Completeness"
    },
    {
      "derived_from": {
        "paragraphs": [
          44,
          45,
          46
        ],
        "principle": 5
      },
      "description": "<p><strong>Principle 5 &mdash; Timeliness.</strong> The bank shall ensure that risk data aggregation capabilities produce aggregate risk information on a timely basis to meet all risk management reporting requirements, with accelerated turnaround for critical risks during stress or crisis conditions.</p><p><em>&para;44:</em> &ldquo;A bank's risk data aggregation capabilities should ensure that it is able to produce aggregate risk information on a timely basis to meet all risk management reporting requirements.&rdquo;</p><p><em>&para;45:</em> &ldquo;Banks need to build their risk systems to be capable of producing aggregated risk data rapidly during times of stress/crisis for all critical risks.&rdquo;</p>",
      "ref": "POL-TIMELY",
      "title": "Timely Risk Data Aggregation"
    },
    {
      "derived_from": {
        "paragraphs": [
          50
        ],
        "principle": 6
      },
      "description": "<p><strong>Principle 6 &mdash; Adaptability.</strong> The bank shall ensure that its risk data aggregation capabilities can respond to ad hoc requests, stress scenarios, and supervisory queries by producing novel aggregations on demand across key dimensions including country, industry, business line, and date, as of any specified reference point.</p><p><em>&para;50:</em> &ldquo;a bank should be able to aggregate risk data quickly on country credit exposures as of a specified date based on a list of countries, as well as industry credit exposures as of a specified date based on a list of industry types across all business lines and geographic areas&rdquo;</p>",
      "ref": "POL-ADAPT",
      "title": "Adaptability of Risk Data Aggregation"
    },
    {
      "derived_from": {
        "paragraphs": [
          52,
          53
        ],
        "principle": 7
      },
      "description": "<p><strong>Principle 7 &mdash; Accuracy (reporting).</strong> The bank shall ensure that risk management reports are accurate and precise, supported by defined reconciliation processes between reports and underlying risk data, and by validation rules, edit checks, and exception reporting that confirm the integrity of reported figures.</p><p><em>&para;52:</em> &ldquo;Risk management reports should be accurate and precise to ensure a bank's board and senior management can rely with confidence on the aggregated information to make critical decisions about risk.&rdquo;</p><p><em>&para;53:</em> &ldquo;To ensure the accuracy of the reports, a bank should maintain, at a minimum, the following: (a) Defined requirements and processes to reconcile reports to risk data.&rdquo;</p>",
      "ref": "POL-RPTACCURACY",
      "title": "Risk Report Accuracy and Reconciliation"
    },
    {
      "derived_from": {
        "paragraphs": [
          57
        ],
        "principle": 8
      },
      "description": "<p><strong>Principle 8 &mdash; Comprehensiveness.</strong> The bank shall ensure that risk management reports cover all significant risk areas and all significant components of those risk areas, including dimensional breakdowns by single name, country, and industry sector for credit risk, so that the data elements feeding those reports are identified, classified, and demonstrably complete.</p><p><em>&para;57:</em> &ldquo;Risk management reports should include exposure and position information for all significant risk areas (eg credit risk, market risk, liquidity risk, operational risk) and all significant components of those risk areas (eg single name, country and industry sector for credit risk).&rdquo;</p>",
      "ref": "POL-RPTCOMPREHENSIVE",
      "title": "Risk Report Comprehensiveness"
    }
  ],
  "policy_group": {
    "description": "Policies and standards implementing the Basel Committee on Banking Supervision's Principles for effective risk data aggregation and risk reporting (BCBS 239) within the data catalog. Covers global and domestic systemically important banks across all legal entities, business lines, and geographies in both normal and stress/crisis conditions.",
    "ref": "PG-BCBS239",
    "title": "BCBS 239"
  },
  "regulation": {
    "id": "BCBS239",
    "published": "2013-01-09",
    "publisher": "Basel Committee on Banking Supervision",
    "source_url": "https://www.bis.org/publ/bcbs239.pdf",
    "title": "Principles for effective risk data aggregation and risk reporting"
  },
  "standard_attachment": {
    "$comment": "DERIVED by alation_agent_kit.authoring.derive_attachment from each policy's principle. Not model output: it is a function of the policies and standards above, and asking a model for a derivable value invites a contradiction.",
    "by_principle": {
      "1": [],
      "10": [],
      "11": [],
      "2": [
        "STD-DATAARCH"
      ],
      "3": [
        "STD-ACCURACY"
      ],
      "4": [
        "STD-COMPLETE"
      ],
      "5": [
        "STD-TIMELY"
      ],
      "6": [
        "STD-ADAPT"
      ],
      "7": [
        "STD-RPTACCURACY"
      ],
      "8": [
        "STD-RPTCOMPREHENSIVE"
      ],
      "9": []
    }
  },
  "standards": [
    {
      "derived_requirements": [
        {
          "description": "Attests that this data element is governed by exactly one identifier per real-world object and that the authoritative register for that identifier is identified, per &para;33.",
          "fields": [
            {
              "allowed_values": [
                "Yes &ndash; documented in catalog",
                "Yes &ndash; not yet documented in catalog",
                "No &ndash; multiple competing sources exist",
                "Under investigation"
              ],
              "name": "Single authoritative source identified",
              "type": "picker"
            },
            {
              "name": "Name and system reference of the authoritative identifier register",
              "type": "text"